{
  "schemaVersion": "1.0.0",
  "artifactType": "work-assignment",
  "fixture": false,
  "source": "human-approved-decision-plan",
  "sessionId": "clone-demo-architecture-pilot",
  "assignmentId": "clone-demo-journal",
  "title": "Build the same-device Clone operation journal and state machine",
  "ownerAgent": "codex",
  "ownerRole": "engineer",
  "mode": "implementation",
  "objective": "Implement the minimal versioned localStorage journal and deterministic operation state machine for same-device, same-browser Clone recovery.",
  "allowedPaths": [
    "src/features/onboarding/cloneOperationJournal.js",
    "src/features/onboarding/cloneOperationJournal.test.js",
    "src/features/onboarding/cloneOperationState.js",
    "src/features/onboarding/cloneOperationState.test.js"
  ],
  "forbiddenPaths": [
    "src/App.jsx",
    "src/features/onboarding/DemoTripPreview.jsx",
    "src/features/offline/offlineTripCache.js",
    "src/features/tickets",
    "src/features/expenses",
    "database.rules.json",
    "storage.rules",
    "firebase.json",
    "src/firebase.js",
    "package.json",
    "package-lock.json",
    ".env.local"
  ],
  "dependencies": [
    "clone-demo-converter"
  ],
  "acceptanceCriteria": [
    "Run a localStorage write, read, and remove availability preflight before Clone confirmation.",
    "Persist only schemaVersion, operationId, roomId, templateVersion, title, startDate, payloadFingerprint, state, createdAt, and updatedAt.",
    "Apply a seven-day expiry and validate the journal schema and template version before recovery.",
    "Validate operation, room, template-derived IDs, state, and payload fingerprint on every recovery.",
    "Treat every Journal record as untrusted input and never persist the transformed trip payload.",
    "Describe and implement recovery as same-device and same-browser only, without cross-device guarantees.",
    "Share one in-flight operation for duplicate confirmation and reuse the same operation identity across retry and reload.",
    "Never automatically write from an expired, invalid, stale, or incompatible Journal.",
    "Use the fingerprint only for consistency checking, never as authorization or a security signature."
  ],
  "validation": [
    "npm run test:run -- src/features/onboarding/cloneOperationJournal.test.js src/features/onboarding/cloneOperationState.test.js",
    "npm run typecheck",
    "npm run lint",
    "git diff --check"
  ],
  "reviewer": "codex-reviewer",
  "qaOwner": "codex-qa",
  "executionEnabled": false
}
